<!ELEMENT books (book*)>
<!ELEMENT book (isbn, title, year, language, author+)>


<!ATTLIST book id CDATA #REQUIRED>

<!ELEMENT isbn (#PCDATA)>
<!ELEMENT title (#PCDATA)>
<!ELEMENT year (#PCDATA)>
<!ELEMENT language (#PCDATA)>
<!ELEMENT author (#PCDATA)>